<?xml version="1.0" encoding="UTF-8"?>
<persephone_parameters xmlns="http://persephone.epistemix.com/persephoneParameters"
                       xmlns:xsi="http://www.w3.org/2001/XMLSchema-instance"
                       xsi:schemaLocation="http://persephone.epistemix.com/persephoneParameters defaultPersephoneParams.xsd">
  <simulation>
    <rng_seed>123456</rng_seed>
    <home_directory>/test/home</home_directory>
    <start_date>2002-09-24</start_date>
    <end_date>2003-09-24</end_date>
    <population_directory>/Volumes/MAC-EXTENDED/Persephone_Populations</population_directory>
    <population>
      <identifier>2010_ver1_01</identifier>
      <identifier>2010_ver1_02</identifier>
      <country>usa</country>
      <version>2010_ver1</version>
    </population>
    <population>
      <identifier>2010_ver1_03</identifier>
      <country>usa</country>
      <version>2010_ver1</version>
    </population>
  </simulation>
  <message_queue>
    <host>130.49.208.17</host>
    <username>username</username>
    <password>abcd1234</password>
    <rpc_lstnr_queue_name>sprcntrllr.rpc</rpc_lstnr_queue_name>
    <cntrllr_rpc_lstnr_queue_name>cntrllr.01.rpc</cntrllr_rpc_lstnr_queue_name>
    <rpc_timeout>1000</rpc_timeout>
  </message_queue>
  <model>
    <condition>
      <condition_name>INF</condition_name>
      <transmission_mode>proximity</transmission_mode>
      <transmissibility>1.0</transmissibility>
      <state>
        <state_name>S</state_name>
      </state>
      <state>
        <state_name>E</state_name>
      </state>
      <state>
        <state_name>Is</state_name>
      </state>
      <state>
        <state_name>Ia</state_name>
      </state>
      <state>
        <state_name>R</state_name>
      </state>
    </condition>
    <place>
      <place_name>Hospital</place_name>
    </place>
  </model>
</persephone_parameters>